Authors	Title	Journal	Year	Publication_citation	Abstract	Keywords	Date_epublished	PMID
Topol, Eric J	High-performance medicine: the convergence of human and artificial intelligence.	Nat Med	2019	Nat Med. 2019 Jan;25(1):44-56. doi: 10.1038/s41591-018-0300-7. Epub 2019 Jan 7.	The use of artificial intelligence, and the deep-learning subtype in particular, has been enabled by the use of labeled big data, along with markedly enhanced computing power and cloud storage, across all sectors. In medicine, this is beginning to have an impact at three levels: for clinicians, predominantly via rapid, accurate image interpretation; for health systems, by improving workflow and the potential for reducing medical errors; and for patients, by enabling them to process their own data to promote health. The current limitations, including bias, privacy and security, and lack of transparency, along with the future directions of these applications will be discussed in this article. Over time, marked improvements in accuracy, productivity, and workflow will likely be actualized, but whether that will be used to improve the patient-doctor relationship or facilitate its erosion remains to be seen.		20190107	https://pubmed.ncbi.nlm.nih.gov/30617339
Norgeot, Beau; Glicksberg, Benjamin S; Butte, Atul J	A call for deep-learning healthcare.	Nat Med	2019	Nat Med. 2019 Jan;25(1):14-15. doi: 10.1038/s41591-018-0320-3.	?		?	https://pubmed.ncbi.nlm.nih.gov/30617337
Esteva, Andre; Robicquet, Alexandre; Ramsundar, Bharath; Kuleshov, Volodymyr; DePristo, Mark; Chou, Katherine; Cui, Claire; Corrado, Greg; Thrun, Sebastian; Dean, Jeff	A guide to deep learning in healthcare.	Nat Med	2019	Nat Med. 2019 Jan;25(1):24-29. doi: 10.1038/s41591-018-0316-z. Epub 2019 Jan 7.	Here we present deep-learning techniques for healthcare, centering our discussion on deep learning in computer vision, natural language processing, reinforcement learning, and generalized methods. We describe how these computational techniques can impact a few key areas of medicine and explore how to build end-to-end systems. Our discussion of computer vision focuses largely on medical imaging, and we describe the application of natural language processing to domains such as electronic health record data. Similarly, reinforcement learning is discussed in the context of robotic-assisted surgery, and generalized deep-learning methods for genomics are reviewed.		20190107	https://pubmed.ncbi.nlm.nih.gov/30617335
Gottesman, Omer; Johansson, Fredrik; Komorowski, Matthieu; Faisal, Aldo; Sontag, David; Doshi-Velez, Finale; Celi, Leo Anthony	Guidelines for reinforcement learning in healthcare.	Nat Med	2019	Nat Med. 2019 Jan;25(1):16-18. doi: 10.1038/s41591-018-0310-5.	?		?	https://pubmed.ncbi.nlm.nih.gov/30617332
Gurovich, Yaron; Hanani, Yair; Bar, Omri; Nadav, Guy; Fleischer, Nicole; Gelbman, Dekel; Basel-Salmon, Lina; Krawitz, Peter M; Kamphausen, Susanne B; Zenker, Martin; Bird, Lynne M; Gripp, Karen W	Identifying facial phenotypes of genetic disorders using deep learning.	Nat Med	2019	Nat Med. 2019 Jan;25(1):60-64. doi: 10.1038/s41591-018-0279-0. Epub 2019 Jan 7.	Syndromic genetic conditions, in aggregate, affect 8% of the population(1). Many syndromes have recognizable facial features(2) that are highly informative to clinical geneticists(3-5). Recent studies show that facial analysis technologies measured up to the capabilities of expert clinicians in syndrome identification(6-9). However, these technologies identified only a few disease phenotypes, limiting their role in clinical settings, where hundreds of diagnoses must be considered. Here we present a facial image analysis framework, DeepGestalt, using computer vision and deep-learning algorithms, that quantifies similarities to hundreds of syndromes. DeepGestalt outperformed clinicians in three initial experiments, two with the goal of distinguishing subjects with a target syndrome from other syndromes, and one of separating different genetic subtypes in Noonan syndrome. On the final experiment reflecting a real clinical setting problem, DeepGestalt achieved 91% top-10 accuracy in identifying the correct syndrome on 502 different images. The model was trained on a dataset of over 17,000 images representing more than 200 syndromes, curated through a community-driven phenotyping platform. DeepGestalt potentially adds considerable value to phenotypic evaluations in clinical genetics, genetic testing, research and precision medicine.		20190107	https://pubmed.ncbi.nlm.nih.gov/30617323
Abbott, Brianna	Deeper learning.	Nat Med	2019	Nat Med. 2019 Jan;25(1):9-11. doi: 10.1038/s41591-018-0313-2.	?		?	https://pubmed.ncbi.nlm.nih.gov/30617322
Hannun, Awni Y; Rajpurkar, Pranav; Haghpanahi, Masoumeh; Tison, Geoffrey H; Bourn, Codie; Turakhia, Mintu P; Ng, Andrew Y	Cardiologist-level arrhythmia detection and classification in ambulatory electrocardiograms using a deep neural network.	Nat Med	2019	Nat Med. 2019 Jan;25(1):65-69. doi: 10.1038/s41591-018-0268-3. Epub 2019 Jan 7.	Computerized electrocardiogram (ECG) interpretation plays a critical role in the clinical ECG workflow(1). Widely available digital ECG data and the algorithmic paradigm of deep learning(2) present an opportunity to substantially improve the accuracy and scalability of automated ECG analysis. However, a comprehensive evaluation of an end-to-end deep learning approach for ECG analysis across a wide variety of diagnostic classes has not been previously reported. Here, we develop a deep neural network (DNN) to classify 12 rhythm classes using 91,232 single-lead ECGs from 53,549 patients who used a single-lead ambulatory ECG monitoring device. When validated against an independent test dataset annotated by a consensus committee of board-certified practicing cardiologists, the DNN achieved an average area under the receiver operating characteristic curve (ROC) of 0.97. The average F1 score, which is the harmonic mean of the positive predictive value and sensitivity, for the DNN (0.837) exceeded that of average cardiologists (0.780). With specificity fixed at the average specificity achieved by cardiologists, the sensitivity of the DNN exceeded the average cardiologist sensitivity for all rhythm classes. These findings demonstrate that an end-to-end deep learning approach can classify a broad range of distinct arrhythmias from single-lead ECGs with high diagnostic performance similar to that of cardiologists. If confirmed in clinical settings, this approach could reduce the rate of misdiagnosed computerized ECG interpretations and improve the efficiency of expert human ECG interpretation by accurately triaging or prioritizing the most urgent conditions.		20190107	https://pubmed.ncbi.nlm.nih.gov/30617320
Arnaout, Rima	Toward a clearer picture of health.	Nat Med	2019	Nat Med. 2019 Jan;25(1):12. doi: 10.1038/s41591-018-0318-x.	?		?	https://pubmed.ncbi.nlm.nih.gov/30613101
Schwemmer, Michael A; Skomrock, Nicholas D; Sederberg, Per B; Ting, Jordyn E; Sharma, Gaurav; Bockbrader, Marcia A; Friedenberg, David A	Meeting brain-computer interface user performance expectations using a deep neural network decoding framework.	Nat Med	2018	Nat Med. 2018 Nov;24(11):1669-1676. doi: 10.1038/s41591-018-0171-y. Epub 2018 Sep 24.	Brain-computer interface (BCI) neurotechnology has the potential to reduce disability associated with paralysis by translating neural activity into control of assistive devices(1-9). Surveys of potential end-users have identified key BCI system features(10-14), including high accuracy, minimal daily setup, rapid response times, and multifunctionality. These performance characteristics are primarily influenced by the BCI's neural decoding algorithm(1,15), which is trained to associate neural activation patterns with intended user actions. Here, we introduce a new deep neural network(16) decoding framework for BCI systems enabling discrete movements that addresses these four key performance characteristics. Using intracortical data from a participant with tetraplegia, we provide offline results demonstrating that our decoder is highly accurate, sustains this performance beyond a year without explicit daily retraining by combining it with an unsupervised updating procedure(3,17-20), responds faster than competing methods(8), and can increase functionality with minimal retraining by using a technique known as transfer learning(21). We then show that our participant can use the decoder in real-time to reanimate his paralyzed forearm with functional electrical stimulation (FES), enabling accurate manipulation of three objects from the grasp and release test (GRT)(22). These results demonstrate that deep neural network decoders can advance the clinical translation of BCI technology.		20180924	https://pubmed.ncbi.nlm.nih.gov/30250141
Coudray, Nicolas; Ocampo, Paolo Santiago; Sakellaropoulos, Theodore; Narula, Navneet; Snuderl, Matija; Fenyo, David; Moreira, Andre L; Razavian, Narges; Tsirigos, Aristotelis	Classification and mutation prediction from non-small cell lung cancer histopathology images using deep learning.	Nat Med	2018	Nat Med. 2018 Oct;24(10):1559-1567. doi: 10.1038/s41591-018-0177-5. Epub 2018 Sep 17.	Visual inspection of histopathology slides is one of the main methods used by pathologists to assess the stage, type and subtype of lung tumors. Adenocarcinoma (LUAD) and squamous cell carcinoma (LUSC) are the most prevalent subtypes of lung cancer, and their distinction requires visual inspection by an experienced pathologist. In this study, we trained a deep convolutional neural network (inception v3) on whole-slide images obtained from The Cancer Genome Atlas to accurately and automatically classify them into LUAD, LUSC or normal lung tissue. The performance of our method is comparable to that of pathologists, with an average area under the curve (AUC) of 0.97. Our model was validated on independent datasets of frozen tissues, formalin-fixed paraffin-embedded tissues and biopsies. Furthermore, we trained the network to predict the ten most commonly mutated genes in LUAD. We found that six of them-STK11, EGFR, FAT1, SETBP1, KRAS and TP53-can be predicted from pathology images, with AUCs from 0.733 to 0.856 as measured on a held-out population. These findings suggest that deep-learning models can assist pathologists in the detection of cancer subtype or gene mutations. Our approach can be applied to any cancer type, and the code is available at https://github.com/ncoudray/DeepPATH .		20180917	https://pubmed.ncbi.nlm.nih.gov/30224757
Lynch, Charles J; Liston, Conor	New machine-learning technologies for computer-aided diagnosis.	Nat Med	2018	Nat Med. 2018 Sep;24(9):1304-1305. doi: 10.1038/s41591-018-0178-4.	?		?	https://pubmed.ncbi.nlm.nih.gov/30177823
De Fauw, Jeffrey; Ledsam, Joseph R; Romera-Paredes, Bernardino; Nikolov, Stanislav; Tomasev, Nenad; Blackwell, Sam; Askham, Harry; Glorot, Xavier; O'Donoghue, Brendan; Visentin, Daniel; van den Driessche, George; Lakshminarayanan, Balaji; Meyer, Clemens; Mackinder, Faith; Bouton, Simon; Ayoub, Kareem; Chopra, Reena; King, Dominic; Karthikesalingam, Alan; Hughes, Cian O; Raine, Rosalind; Hughes, Julian; Sim, Dawn A; Egan, Catherine; Tufail, Adnan; Montgomery, Hugh; Hassabis, Demis; Rees, Geraint; Back, Trevor; Khaw, Peng T; Suleyman, Mustafa; Cornebise, Julien; Keane, Pearse A; Ronneberger, Olaf	Clinically applicable deep learning for diagnosis and referral in retinal disease.	Nat Med	2018	Nat Med. 2018 Sep;24(9):1342-1350. doi: 10.1038/s41591-018-0107-6. Epub 2018 Aug 13.	The volume and complexity of diagnostic imaging is increasing at a pace faster than the availability of human expertise to interpret it. Artificial intelligence has shown great promise in classifying two-dimensional photographs of some common diseases and typically relies on databases of millions of annotated images. Until now, the challenge of reaching the performance of expert clinicians in a real-world clinical pathway with three-dimensional diagnostic scans has remained unsolved. Here, we apply a novel deep learning architecture to a clinically heterogeneous set of three-dimensional optical coherence tomography scans from patients referred to a major eye hospital. We demonstrate performance in making a referral recommendation that reaches or exceeds that of experts on a range of sight-threatening retinal diseases after training on only 14,884 scans. Moreover, we demonstrate that the tissue segmentations produced by our architecture act as a device-independent representation; referral accuracy is maintained when using tissue segmentations from a different type of device. Our work removes previous barriers to wider clinical use without prohibitive training data requirements across multiple pathologies in a real-world setting.		20180813	https://pubmed.ncbi.nlm.nih.gov/30104768
Ting, Daniel S W; Liu, Yong; Burlina, Philippe; Xu, Xinxing; Bressler, Neil M; Wong, Tien Y	AI for medical imaging goes deep.	Nat Med	2018	Nat Med. 2018 May;24(5):539-540. doi: 10.1038/s41591-018-0029-3.	?		?	https://pubmed.ncbi.nlm.nih.gov/29736024
Richerson, George B; Bekkers, John M	Learning to take a deep breath--with BDNF.	Nat Med	2004	Nat Med. 2004 Jan;10(1):25-6. doi: 10.1038/nm0104-25.	?		?	https://pubmed.ncbi.nlm.nih.gov/14702628
